Release-note,Review1,Review2,Review3,Review4,Review5,Review6,Review7,Review8,Review9,Review10
Release Note : Use our new “People Management” feature to control who is able to access and view your site.,"i like this app but i wish it gave the ability to manage user accounts perhaps it does and i just cant figure it out so for account and page management it would get 4 stars but with no user management it loses a star   
 (0.85)","i have a site for my class and students and then a site for an organization i sponsor everything i try to log out of the organization site and log into my own it sends me back to the organization site it also wont let me add an existing site even tried uninstall and reinstall and it defaulted again to the organization site not helpful at all   
 (0.87)","i have used the application and it has worked well in the past however this last update had issues that do not allow for login frustrating   
 (0.87)","cant login to the application    
 (0.86)","its ok bit hard to figure out what the buttons do and how to make a site but youll get the hang of it   
 (0.86)","the site is just too awsome      
 (0.85)","very easy to use the only thing is i am having trouble adding content and media to my site and it keeps saying couldnt refresh at this time and it sometimes crashes   
 (0.85)",,,
Release Note : New languages supported: Malay and Spanish (Venezuela).,"when first downloaded it worked well now that it is synced with my account it wont post blogs or allow me to see other wordpress functionsmenus   
 (0.85)","was great now my new posts go to a local draft folder why wont it post frustrating   
 (0.87)","what kind of username i can write in wordpress i cannot understand   
 (0.87)","i do wonder why my italic suddenly shut down while i was writing in italic mode its annoying or the italic suddenly off while i wrote on the sexond word   
 (0.85)","the new line characters are not appearing very well   
 (0.85)","great app but it accepts a lot of strange words which are not in the common norwegian dictionary   
 (0.85)","i dont understand why i see all the texts from the discovery parts translated into my mother tongue i research things in english then it appears in turkish i double checked the settings but the same   
 (0.85)",,,
Release Note : What’s that sound? Set a customized notification sound.,"when i try to open the notifications screen it just goes blank needs to be fixed   
 (0.82)",,,,,,,,,
Release Note : What’s that sound? Set a customized notification sound.,"when i try to open the notifications screen it just goes blank needs to be fixed   
 (0.82)",,,,,,,,,
Release Note : What’s that sound? Set a customized notification sound.,"when i try to open the notifications screen it just goes blank needs to be fixed   
 (0.82)",,,,,,,,,
